profileKey,timePeriod,metricKey,label,lowerBound,upperBound,observedValue,n,unit,method,reliability,note,sourceName,sourceUrl
us-scotus-ot2024,OT2024,intake_filings,Docketed non-original matters,3600,4100,3854,1,count,Supreme Court docket summary,medium,Top-court filings used to anchor intake scaling,Supreme Court Journal,https://www.supremecourt.gov/
us-scotus-ot2024,OT2024,cert_grants,Certiorari grants,60,76,68,1,count,Supreme Court docket summary,medium,Ordinary cert grants in the term,Supreme Court Journal,https://www.supremecourt.gov/
us-scotus-ot2024,OT2024,intake_acceptance_rate,Certiorari grant rate,0.013,0.018,0.0176,3854,share,grants divided by docketed non-original matters,medium,Ordinary cert acceptance proxy used by calibration,Supreme Court Journal,https://www.supremecourt.gov/
us-scotus-2002-2014,2002-2014,state_high_court_merits_share,State high-court merits origin share,0.120,0.170,0.144,0,share,merits-origin study summary,medium,State high-court share informs state-case pipeline checks,Lower-court pipeline research synthesis,
us-scotus-modern,modern,conflict_share,Broad lower-court conflict share,0.350,0.500,0.425,0,share,circuit-split proxy range,low,Broad conflict is a proxy because cert-stage conflict categories vary,Lower-court pipeline research synthesis,
us-federal-appeals-fy2025,FY2025,en_banc_merits_termination_rate,En banc merits termination rate,0.001,0.007,0.0016,0,share,federal appeals administrative summary,medium,En banc activity anchors panel versus en banc review scaling,Lower-court pipeline research synthesis,
us-scotus-modern,modern,grant_to_argument_days,Grant-to-argument delay,110,160,135.6,0,days,term-timing synthesis,medium,Time-to-review anchor for ordinary cert pipeline,Lower-court pipeline research synthesis,
us-scotus-modern,modern,grant_to_decision_days,Grant-to-decision delay,228,246,237,0,days,term-timing synthesis,medium,Decision delay anchor for final review timing,Lower-court pipeline research synthesis,
